### ISSUE TITLE
Lua Error :875 bad argument #2 to 'remove' number expected, got string

### ISSUE THREAD

**Issue by anthaeus** [ntop/nDPI#495]
packet:
6628	2017-11-22 22:44:20.465151	172.20.10.2	47028	db5.vortex.data.microsoft.com.akadns.net	443	TCP	94	47028→443 [ACK] Seq=1 Ack=1 Win=29312 Len=0 TSval=97770369 TSecr=108602559 [ETHERNET FRAME CHECK SEQUENCE INCORRECT]

0000   62 b3 95 8c 5c 64 60 67 20 89 4e 68 08 00 45 00
0010   00 34 3f 1a 40 00 40 06 3a 4c ac 14 0a 02 28 4d
0020   e2 fa b7 b4 01 bb 45 26 e4 09 62 57 5d 76 80 10
0030   00 e5 05 80 00 00 01 01 08 0a 05 d3 db 81 06 79
0040   24 bf 19 68 09 24 00 00 00 00 55 6e 6b 6e 6f 77
0050   6e 00 00 00 00 00 00 00 00 00 ff ff ff ff

bug:
Frame 6628: 94 bytes on wire (752 bits), 94 bytes captured (752 bits) on interface 0
Ethernet II, Src: IntelCor_  Dst: 62:b3:95:8c:5c:64 (62:b3:95:8c:5c:64)
    Destination: 62:b3:95:8c:5c:64 (62:b3:95:8c:5c:64)
    Source: IntelCor_
    Type: IPv4 (0x0800)
    Trailer: 1968092400000000556e6b6e6f776e000000000000000000
    Frame check sequence: 0xffffffff [incorrect, should be 0xaffec0b4]
        [Expert Info (Error/Checksum): Bad checksum [should be 0xaffec0b4]]
    [FCS Status: Bad]
Internet Protocol Version 4, Src: 172.20.10.2 (172.20.10.2), Dst: db5.vortex.data.microsoft.com.akadns.net (40.77.226.250)
Transmission Control Protocol, Src Port: 47028, Dst Port: 443, Seq: 1, Ack: 1, Len: 0
nDPI Protocol
    nDPI Network Protocol: 0
    nDPI Application Protocol: 0
    nDPI Protocol Name: Unknown
Lua Error: [string "/usr/lib64/wireshark/plugins/2.2.2/ndpi.lua"]:875: bad argument #2 to 'remove' (number expected, got string)
    [Expert Info (Error/Undecoded): Lua Error: [string "/usr/lib64/wireshark/plugins/2.2.2/ndpi.lua"]:875: bad argument #2 to 'remove' (number expected, got string)]
        [Lua Error: [string "/usr/lib64/wireshark/plugins/2.2.2/ndpi.lua"]:875: bad argument #2 to 'remove' (number expected, got string)]
        [Severity level: Error]
        [Group: Undecoded]

**Comment by lucaderi** [comment]
You need wireshark 2.4 or later
